<?xml version="1.0" encoding="UTF-8"?>
<ConformanceContext UUID="xxx"
	xmlns:xsi="http://www.w3.org/2001/XMLSchema-instance"
	xsi:noNamespaceSchemaLocation="ConformanceContext.xsd"
	>
	
	<MetaData>
		<Description>Conformance context sample</Description>
	</MetaData>
	
	<Predicates>
		
	</Predicates>
	
	<Constraints>
		
		<Segment>
		    <ByName Name="OBX">
		        
		        <Constraint ID="Co-Constraint">
		            <Description>If OBX.3 = XX then OBX.2 = CWE and OBX.5 valued from VS1</Description>
		            <Assertion>
		                <!-- <IMPLY>
							<PlainText Path="3[1]" Text="1" IgnoreCase="false"/>
							<AND>
								<PlainText Path="2[1]" Text="CWE" IgnoreCase="false"/>
								<ValueSet Path="5[1]" ValueSetID="VSID" BindingStrength="R" BindingLocation="1:3"/>
							</AND>
						</IMPLY> -->
		                <OR>
		                    <NOT><PlainText Path="3[1].1[1]" Text="XX" IgnoreCase="false"/></NOT>
		                    <AND>
		                        <PlainText Path="2[1]" Text="CWE" IgnoreCase="false"/>
		                        <ValueSet Path="5[1]" ValueSetID="VS1" BindingStrength="R" BindingLocation="1:4"/>
		                    </AND>
		                </OR>
		            </Assertion>
		        </Constraint>
		    </ByName>
		</Segment>
		
	</Constraints>
	
</ConformanceContext>